### ISSUE TITLE
Connection to chirpstack

### ISSUE THREAD

**Issue by sergorl** [helium/virtual-lorawan-device#37]
Guys, do you know how to connect your `virtual-lorawan-device` to `chirpstack`?

I tried this one config:

```toml

[packet_forwarder.default]
host = "gateway bridge ip:1700"
#host = "localhost:1700"
mac = "f69e8a9ca4a0236f"
```

But got this line: `[2022-05-23T14:53:16Z WARN  virtual_lorawan_device::virtual_device] one      No Join Accept Received`

**Comment by lthiery** [comment]
I've done it before, yes. Did you see the connection on CS? You have to make sure the regions and EUIs match what you have on the CS LNS part.

**Comment by sergorl** [comment]
But gateway status is `Never seen` despite `mac = GWID`

**Comment by sergorl** [comment]
@lthiery , `http://127.0.0.1:9898/` give me this:

```
# HELP join_fail join fail counter
# TYPE join_fail counter
join_fail{server="prod"} 149
```

**Comment by lthiery** [comment]
Right, so that's just telling you that Joins are failing which is 100% expected if you're not getting the data to show up on CS yet.

Maybe try reverseing the MAC bytes for GWID? Maybe there's an endianness disagreement between the utility and CS. I last connected them over a year ago, so that might've been a thing I did to solve it.

**Comment by sergorl** [comment]
@lthiery , no, it doesn't work

**Comment by sergorl** [comment]
@lthiery , I use your release and also the same problem on `Ubuntu`:

```bash
root@ip:/home/repositories/virtual-lorawan# ./virtual-lorawan-device
Error: Config(configuration file "./settings/default.toml" not found)
root@ip-172-31-1-117:/home/repositories/virtual-lorawan# ./virtual-lorawan-device
[2022-05-23T18:39:10Z INFO  virtual_lorawan_device::metrics] Prometheus Server listening on http://127.0.0.1:9898
[2022-05-23T18:39:10Z INFO  virtual_lorawan_device] Creating packet forwarder default connecting to 54.82.149.93:1700 from 0.0.0.0:0
[2022-05-23T18:39:10Z INFO  virtual_lorawan_device::virtual_device::udp_radio] Transmit tmst: 77117
[2022-05-23T18:39:16Z WARN  virtual_lorawan_device::virtual_device] one      No Join Accept Received
[2022-05-23T18:39:16Z INFO  virtual_lorawan_device::virtual_device::udp_radio] Transmit tmst: 6178620
[2022-05-23T18:39:22Z WARN  virtual_lorawan_device::virtual_device] one      No Join Accept Received
[2022-05-23T18:39:22Z INFO  virtual_lorawan_device::virtual_device::udp_radio] Transmit tmst: 12280415
[2022-05-23T18:39:28Z WARN  virtual_lorawan_device::virtual_device] one      No Join Accept Received
[2022-05-23T18:39:28Z INFO  virtual_lorawan_device::virtual_device::udp_radio] Transmit tmst: 18381603

```

**Comment by lthiery** [comment]
Can you check on the CS system and confirm that the UDP packets are making it into the OS? You could use pcap or something.

**Comment by sergorl** [comment]
@lthiery , here is the log from `tcpdump -n udp port 1700`:

```bash
ubuntu@ip:~$ sudo tcpdump -n udp port 1700
tcpdump: verbose output suppressed, use -v or -vv for full protocol decode
listening on veth52727cb, link-type EN10MB (Ethernet), capture size 262144 bytes
20:06:10.254889 IP 3.73.10.173.43616 > 172.20.0.5.1700: RADIUS, Access-Accept (2), id: 0x41 length: 290
20:06:10.255731 IP 172.20.0.5.1700 > 3.73.10.173.43616:  [|radius]
20:06:11.996320 IP 3.73.10.173.46561 > 172.20.0.5.1700: RADIUS, Access-Accept (2), id: 0x92 length: 111
20:06:11.996908 IP 172.20.0.5.1700 > 3.73.10.173.46561:  [|radius]
20:06:12.903849 IP 95.161.223.81.58527 > 172.20.0.5.1700:  [|radius]
20:06:12.904279 IP 172.20.0.5.1700 > 95.161.223.81.58527:  [|radius]
20:06:13.232615 IP 95.161.223.81.58527 > 172.20.0.5.1700: RADIUS, Access-Accept (2), id: 0xd6 length: 202
20:06:13.233581 IP 172.20.0.5.1700 > 95.161.223.81.58527:  [|radius]
20:06:13.864790 IP 3.73.10.173.60802 > 172.20.0.5.1700:  [|radius]
20:06:13.865037 IP 172.20.0.5.1700 > 3.73.10.173.60802:  [|radius]
20:06:13.933467 IP 3.73.10.173.39236 > 172.20.0.5.1700:  [|radius]
20:06:13.933705 IP 172.20.0.5.1700 > 3.73.10.173.39236:  [|radius]
20:06:19.358886 IP 95.161.223.81.58527 > 172.20.0.5.1700: RADIUS, Access-Accept (2), id: 0x15 length: 202
20:06:19.359644 IP 172.20.0.5.1700 > 95.161.223.81.58527:  [|radius]
20:06:22.916166 IP 95.161.223.81.58527 > 172.20.0.5.1700:  [|radius]
20:06:22.916562 IP 172.20.0.5.1700 > 95.161.223.81.58527:  [|radius]
20:06:23.958658 IP 3.73.10.173.39236 > 172.20.0.5.1700:  [|radius]
20:06:23.959050 IP 172.20.0.5.1700 > 3.73.10.173.39236:  [|radius]
20:06:23.964946 IP 3.73.10.173.60802 > 172.20.0.5.1700:  [|radius]
20:06:23.965177 IP 172.20.0.5.1700 > 3.73.10.173.60802:  [|radius]
```

my ip is `95.161.223.81`

**Comment by lthiery** [comment]
Sure does look like it's making it to the server... so it's gotta be something else.

Have you checked that the region is properly set? That's the only other gotcha that comes to mind from when I set it up.

**Comment by sergorl** [comment]
yes, I did:

```toml

default_server = "prod"
default_packet_forwarder = "default"
# if any explicit packet forwarders are defined in settings.toml,
# this packet forwarder is pruned from the map
[packet_forwarder.default]
host = "chirp-gateway-bridge:1700"
#host = "99.99.99.99:0"
#mac = "f69e8a9ca4a0236f"
mac = "0807060504030201"
#mac = "f607ef85003ed77e"

[device.one]
region = "EU868"
[device.one.credentials]
dev_eui = "3ed43bef1857ef4b"
app_eui = "35BEED137AC3344B"
app_key = "49660c28e41609415025366051b12982"

```

**Comment by lthiery** [comment]
I meant on Chirpstack, but I assume you've configured the gateway or end-device to be the right thing there too. 

I wish there was a debug view on Chirstpack to understand what it's doing with the packet...

**Comment by lthiery** [comment]
Oh, that's the other thing! Did you check the endianness of the DevEui/AppEui? There's some MSB/LSB conflict somewhere along the way I remember.

**Comment by sergorl** [comment]
@lthiery , you were right, the problem was in `Gateway ID` - it should be `LSB `in `chirp`. Big thanks ;) you are a great man!!!

**Comment by lthiery** [comment]
> @lthiery , you were right, the problem was in `Gateway ID` - it should be `LSB `in `chirp`. Big thanks ;) you are a great man!!!

Glad it worked out!

**Comment by lthiery** [comment]
@sergorl i actually had an old commit where i flip it back so its directly compatible with CS. Just a heads up so you don't spend too much time scratching your head next release

https://github.com/helium/virtual-lorawan-device/commit/a4e97db32e5b71649f45eed4289f7e15b49d1953
